part_id,description,material,group,qty,plate,filename_stl,filename_step,bbox_x_mm,bbox_y_mm,bbox_z_mm,notes,part_no,part_code,label,label_text,name,part_name,quantity,count,material_hint,material_group,is_tpu,split_group,plate_id,plate_group,module,title,stl,stl_file,stl_path,file,filename,path,file_path,source_file,source_path,output_stl,step,step_file,step_path,bbox_x,bbox_y,bbox_z,printable,marked
PS-RV2271-SFS-CENTER-F,front/BBOX retrofit 45-degree central turtle shell; top protection only,PETG/PLA,RIGID,1,SFS-RIGID-01,PS-RV2271-SFS-CENTER-F.stl,PS-RV2271-SFS-CENTER-F.step,194.0,232.0,56.0,Do not attach to BBOX directly; use clamps/adapters. Keep clear of DRC/DRIVE.,PS-RV2271-SFS-CENTER-F,PS-RV2271-SFS-CENTER-F,PS-RV2271-SFS-CENTER-F,PS-RV2271-SFS-CENTER-F,front/BBOX retrofit 45-degree central turtle shell; top protection only,front/BBOX retrofit 45-degree central turtle shell; top protection only,1,1,PETG/PLA,HARD,0,HARD,SFS-RIGID-01,SFS-RIGID-01,v2271_summer_float_shell,front/BBOX retrofit 45-degree central turtle shell; top protection only,stl/PS-RV2271-SFS-CENTER-F.stl,stl/PS-RV2271-SFS-CENTER-F.stl,stl/PS-RV2271-SFS-CENTER-F.stl,stl/PS-RV2271-SFS-CENTER-F.stl,PS-RV2271-SFS-CENTER-F.stl,stl/PS-RV2271-SFS-CENTER-F.stl,stl/PS-RV2271-SFS-CENTER-F.stl,stl/PS-RV2271-SFS-CENTER-F.stl,stl/PS-RV2271-SFS-CENTER-F.stl,stl/PS-RV2271-SFS-CENTER-F.stl,step/PS-RV2271-SFS-CENTER-F.step,step/PS-RV2271-SFS-CENTER-F.step,step/PS-RV2271-SFS-CENTER-F.step,194.0,232.0,56.0,1,1
PS-RV2271-SFS-CENTER-R,rear/CBOX retrofit 45-degree central turtle shell; top protection only,PETG/PLA,RIGID,1,SFS-RIGID-01,PS-RV2271-SFS-CENTER-R.stl,PS-RV2271-SFS-CENTER-R.step,194.0,232.0,56.0,Do not attach to CBOX directly; use clamps/adapters. Leave E-stop visible/accesssible.,PS-RV2271-SFS-CENTER-R,PS-RV2271-SFS-CENTER-R,PS-RV2271-SFS-CENTER-R,PS-RV2271-SFS-CENTER-R,rear/CBOX retrofit 45-degree central turtle shell; top protection only,rear/CBOX retrofit 45-degree central turtle shell; top protection only,1,1,PETG/PLA,HARD,0,HARD,SFS-RIGID-01,SFS-RIGID-01,v2271_summer_float_shell,rear/CBOX retrofit 45-degree central turtle shell; top protection only,stl/PS-RV2271-SFS-CENTER-R.stl,stl/PS-RV2271-SFS-CENTER-R.stl,stl/PS-RV2271-SFS-CENTER-R.stl,stl/PS-RV2271-SFS-CENTER-R.stl,PS-RV2271-SFS-CENTER-R.stl,stl/PS-RV2271-SFS-CENTER-R.stl,stl/PS-RV2271-SFS-CENTER-R.stl,stl/PS-RV2271-SFS-CENTER-R.stl,stl/PS-RV2271-SFS-CENTER-R.stl,stl/PS-RV2271-SFS-CENTER-R.stl,step/PS-RV2271-SFS-CENTER-R.step,step/PS-RV2271-SFS-CENTER-R.step,step/PS-RV2271-SFS-CENTER-R.step,194.0,232.0,56.0,1,1
PS-RV2271-SFS-JOINER-S,front/rear shell joiner strap set; optional bridge between the two central shells,PETG/PLA,RIGID,2,SFS-RIGID-02,PS-RV2271-SFS-JOINER-S.stl,PS-RV2271-SFS-JOINER-S.step,148.0,24.0,6.0,Use two straps left/right or top-side depending on actual assembly clearance.,PS-RV2271-SFS-JOINER-S,PS-RV2271-SFS-JOINER-S,PS-RV2271-SFS-JOINER-S,PS-RV2271-SFS-JOINER-S,front/rear shell joiner strap set; optional bridge between the two central shells,front/rear shell joiner strap set; optional bridge between the two central shells,2,2,PETG/PLA,HARD,0,HARD,SFS-RIGID-02,SFS-RIGID-02,v2271_summer_float_shell,front/rear shell joiner strap set; optional bridge between the two central shells,stl/PS-RV2271-SFS-JOINER-S.stl,stl/PS-RV2271-SFS-JOINER-S.stl,stl/PS-RV2271-SFS-JOINER-S.stl,stl/PS-RV2271-SFS-JOINER-S.stl,PS-RV2271-SFS-JOINER-S.stl,stl/PS-RV2271-SFS-JOINER-S.stl,stl/PS-RV2271-SFS-JOINER-S.stl,stl/PS-RV2271-SFS-JOINER-S.stl,stl/PS-RV2271-SFS-JOINER-S.stl,stl/PS-RV2271-SFS-JOINER-S.stl,step/PS-RV2271-SFS-JOINER-S.step,step/PS-RV2271-SFS-JOINER-S.step,step/PS-RV2271-SFS-JOINER-S.step,148.0,24.0,6.0,1,1
PS-RV2271-SFS-MCR-CLAMP-S,retrofit clamp block for v2.27 MCR rail; keeps shell mounting away from waterproof boxes,PETG/PLA,RIGID,6,SFS-RIGID-02,PS-RV2271-SFS-MCR-CLAMP-S.stl,PS-RV2271-SFS-MCR-CLAMP-S.step,34.0,42.0,22.0,Prototype U-clamp for nominal 18 mm MCR rail. Verify rail fit before tightening/locking.,PS-RV2271-SFS-MCR-CLAMP-S,PS-RV2271-SFS-MCR-CLAMP-S,PS-RV2271-SFS-MCR-CLAMP-S,PS-RV2271-SFS-MCR-CLAMP-S,retrofit clamp block for v2.27 MCR rail; keeps shell mounting away from waterproof boxes,retrofit clamp block for v2.27 MCR rail; keeps shell mounting away from waterproof boxes,6,6,PETG/PLA,HARD,0,HARD,SFS-RIGID-02,SFS-RIGID-02,v2271_summer_float_shell,retrofit clamp block for v2.27 MCR rail; keeps shell mounting away from waterproof boxes,stl/PS-RV2271-SFS-MCR-CLAMP-S.stl,stl/PS-RV2271-SFS-MCR-CLAMP-S.stl,stl/PS-RV2271-SFS-MCR-CLAMP-S.stl,stl/PS-RV2271-SFS-MCR-CLAMP-S.stl,PS-RV2271-SFS-MCR-CLAMP-S.stl,stl/PS-RV2271-SFS-MCR-CLAMP-S.stl,stl/PS-RV2271-SFS-MCR-CLAMP-S.stl,stl/PS-RV2271-SFS-MCR-CLAMP-S.stl,stl/PS-RV2271-SFS-MCR-CLAMP-S.stl,stl/PS-RV2271-SFS-MCR-CLAMP-S.stl,step/PS-RV2271-SFS-MCR-CLAMP-S.step,step/PS-RV2271-SFS-MCR-CLAMP-S.step,step/PS-RV2271-SFS-MCR-CLAMP-S.step,34.0,42.0,22.0,1,1
PS-RV2271-SFS-FLT-RCV-ADAPTER-S,adapter foot for existing FLT-RCV side float receiver; keeps shell/float standoff separated from DRC,PETG/PLA,RIGID,4,SFS-RIGID-02,PS-RV2271-SFS-FLT-RCV-ADAPTER-S.stl,PS-RV2271-SFS-FLT-RCV-ADAPTER-S.step,64.0,32.0,34.0,Use only if it clears DRC/DRIVE/tire sweep. Do not make the side shell touch gearboxes.,PS-RV2271-SFS-FLT-RCV-ADAPTER-S,PS-RV2271-SFS-FLT-RCV-ADAPTER-S,PS-RV2271-SFS-FLT-RCV-ADAPTER-S,PS-RV2271-SFS-FLT-RCV-ADAPTER-S,adapter foot for existing FLT-RCV side float receiver; keeps shell/float standoff separated from DRC,adapter foot for existing FLT-RCV side float receiver; keeps shell/float standoff separated from DRC,4,4,PETG/PLA,HARD,0,HARD,SFS-RIGID-02,SFS-RIGID-02,v2271_summer_float_shell,adapter foot for existing FLT-RCV side float receiver; keeps shell/float standoff separated from DRC,stl/PS-RV2271-SFS-FLT-RCV-ADAPTER-S.stl,stl/PS-RV2271-SFS-FLT-RCV-ADAPTER-S.stl,stl/PS-RV2271-SFS-FLT-RCV-ADAPTER-S.stl,stl/PS-RV2271-SFS-FLT-RCV-ADAPTER-S.stl,PS-RV2271-SFS-FLT-RCV-ADAPTER-S.stl,stl/PS-RV2271-SFS-FLT-RCV-ADAPTER-S.stl,stl/PS-RV2271-SFS-FLT-RCV-ADAPTER-S.stl,stl/PS-RV2271-SFS-FLT-RCV-ADAPTER-S.stl,stl/PS-RV2271-SFS-FLT-RCV-ADAPTER-S.stl,stl/PS-RV2271-SFS-FLT-RCV-ADAPTER-S.stl,step/PS-RV2271-SFS-FLT-RCV-ADAPTER-S.step,step/PS-RV2271-SFS-FLT-RCV-ADAPTER-S.step,step/PS-RV2271-SFS-FLT-RCV-ADAPTER-S.step,64.0,32.0,34.0,1,1
PS-RV2271-SFS-SIDE-STANDOFF-S,sacrificial side standoff/spacer; enforces clearance between shell/side float and gearboxes,PETG/PLA,RIGID,4,SFS-RIGID-03,PS-RV2271-SFS-SIDE-STANDOFF-S.stl,PS-RV2271-SFS-SIDE-STANDOFF-S.step,28.0,24.0,48.0,Use as a clearance gauge/spacer first. Target DRC/DRIVE clearance: 8-10 mm or more.,PS-RV2271-SFS-SIDE-STANDOFF-S,PS-RV2271-SFS-SIDE-STANDOFF-S,PS-RV2271-SFS-SIDE-STANDOFF-S,PS-RV2271-SFS-SIDE-STANDOFF-S,sacrificial side standoff/spacer; enforces clearance between shell/side float and gearboxes,sacrificial side standoff/spacer; enforces clearance between shell/side float and gearboxes,4,4,PETG/PLA,HARD,0,HARD,SFS-RIGID-03,SFS-RIGID-03,v2271_summer_float_shell,sacrificial side standoff/spacer; enforces clearance between shell/side float and gearboxes,stl/PS-RV2271-SFS-SIDE-STANDOFF-S.stl,stl/PS-RV2271-SFS-SIDE-STANDOFF-S.stl,stl/PS-RV2271-SFS-SIDE-STANDOFF-S.stl,stl/PS-RV2271-SFS-SIDE-STANDOFF-S.stl,PS-RV2271-SFS-SIDE-STANDOFF-S.stl,stl/PS-RV2271-SFS-SIDE-STANDOFF-S.stl,stl/PS-RV2271-SFS-SIDE-STANDOFF-S.stl,stl/PS-RV2271-SFS-SIDE-STANDOFF-S.stl,stl/PS-RV2271-SFS-SIDE-STANDOFF-S.stl,stl/PS-RV2271-SFS-SIDE-STANDOFF-S.stl,step/PS-RV2271-SFS-SIDE-STANDOFF-S.step,step/PS-RV2271-SFS-SIDE-STANDOFF-S.step,step/PS-RV2271-SFS-SIDE-STANDOFF-S.step,28.0,24.0,48.0,1,1
PS-RV2271-RCP-DOGHOUSE-G1,high-mounted waterproof E-stop doghouse prototype with 22 mm class sloped button face,PETG/PLA,RIGID,1,SFS-RIGID-03,PS-RV2271-RCP-DOGHOUSE-G1.stl,PS-RV2271-RCP-DOGHOUSE-G1.step,110.0,84.0,74.0,Prototype only. Use a real waterproof panel-mount E-stop; pot/protect rear terminals.,PS-RV2271-RCP-DOGHOUSE-G1,PS-RV2271-RCP-DOGHOUSE-G1,PS-RV2271-RCP-DOGHOUSE-G1,PS-RV2271-RCP-DOGHOUSE-G1,high-mounted waterproof E-stop doghouse prototype with 22 mm class sloped button face,high-mounted waterproof E-stop doghouse prototype with 22 mm class sloped button face,1,1,PETG/PLA,HARD,0,HARD,SFS-RIGID-03,SFS-RIGID-03,v2271_summer_float_shell,high-mounted waterproof E-stop doghouse prototype with 22 mm class sloped button face,stl/PS-RV2271-RCP-DOGHOUSE-G1.stl,stl/PS-RV2271-RCP-DOGHOUSE-G1.stl,stl/PS-RV2271-RCP-DOGHOUSE-G1.stl,stl/PS-RV2271-RCP-DOGHOUSE-G1.stl,PS-RV2271-RCP-DOGHOUSE-G1.stl,stl/PS-RV2271-RCP-DOGHOUSE-G1.stl,stl/PS-RV2271-RCP-DOGHOUSE-G1.stl,stl/PS-RV2271-RCP-DOGHOUSE-G1.stl,stl/PS-RV2271-RCP-DOGHOUSE-G1.stl,stl/PS-RV2271-RCP-DOGHOUSE-G1.stl,step/PS-RV2271-RCP-DOGHOUSE-G1.step,step/PS-RV2271-RCP-DOGHOUSE-G1.step,step/PS-RV2271-RCP-DOGHOUSE-G1.step,110.0,84.0,74.0,1,1
